Stroke	cva (cerebrovascular accident)	brain syndrome, assoc. with brain trauma	trauma, brain	brain hemorrhage	thrombosis, brain	chronic brain syndrome	brain, abscess of	brain cancer	brain, thrombosis of	brain embolism	carcinoma: brain	abscess, brain	organic brain syndrome	brain syndrome, acute	benign neoplasms of the brain	brain trauma, residuals of	cephalgia with syncopal attacks	brain tumor, malignant	embolism, brain vessels	brain, disease due to trauma	brain, vessels, hemorrhage from	brain, vessels, thrombosis of	brain tumor, benign	brain tumor, metastatic	metastatic brain tumor	brain syndrome, unknown etiology	hemorrhage, brain vessels	brain, vessels, embolism of	acute brain syndrome	brain, new growths of, benign	new growths, benign: brain	benign new growths of the brain	growths, new, benign: brain	brain syndrome assoc. with alcoholism	brain syndrome, chronic (unknown etiology)	brain, benign new growths of	growths, new, malignant: brain	brain, new growths of, malignant	new growths, malignant*: brain	malignant new growth of: brain	brain, malignant new growths of	agoraphobia (panic attacks, panic disorder)	brain syndrome assoc. with intracranial neoplasm	brain syndrome assoc. with metabolic disturbance	brain syndrome assoc. with convulsive disorder	panic attacks (panic disorder, agoraphobia)	brain syndrome assoc. with intracranial infection	thrombosis, brain, internal carotid artery	brain & central nervous system, tumors of the	brain syndrome assoc. with cns syphilis	brain trauma, residuals with headaches only	brain syndrome assoc. with circulatory disturbance	brain syndrome assoc. with cerebral arteriosclerosis	mental disorders: delirium, dementia, amnestic & cognitive disorders: dementia: due to other neurologic/general medical conditions (endocrine/metabolic disorders, picks disease, brain tumors, etc.) or substance-induced (drugs, alcohol, poisons)
Osteoporosis (disorder)	osteoporosis: generalized	osteoporosis: with joint involvement
Pathological fracture due to osteoporosis (disorder)	jaw, fracture of	nasal fracture	scotoma, pathological	vertebra fracture	osteoporosis: generalized	toes, fracture of	wrist fracture, healed	fracture, residuals of: clavicle	fracture, residuals of: radius	fracture, residuals of: wrist	fracture, residuals of: vertebra	fracture, residuals of: humerus	fracture, residuals of: knee	fracture, residuals of: calcaneus	fracture, residuals of: elbow	fracture, residuals of: rib	fracture, residuals of: pelvis	osteoporosis: with joint involvement	fracture, residuals of: skull	fracture, residuals of: spine	fracture, residuals of: toes	fracture, residuals of: nose	fracture, residuals of: hip	fracture, residuals of: ulna	fracture, residuals of: finger	fracture, residuals of: femur	fracture, residuals of: fibula	fracture, residuals of: ankle	fracture, residuals of: sternum	fracture, vertebra, residuals of	fracture, residuals of: tibia	fracture, residuals of: cervical spine	fracture, residuals of: os calcis or astragalus	fracture, residuals of: compression type, lumbar vertebra	fracture, residuals of: carpal navicular bone	fracture, vertebra, compression, with hypertrophic arthritis	fracture, residuals of: skull with neuro residuals
Alzheimer's disease (disorder)	alzheimer's type dementia (alzheimer's disease)	dementia, alzheimer's type (alzheimer's disease)	renal disease: involvment in other diseases	cardiovascular-renal disease	hodgkin's disease	disease, grave's	acneform disease	meniere's disease	raynaud's disease	disease, morton's	disease, addison's	osgood-schlatter's disease	scheuermann's disease	disease, jakob-creutzfeldt	skin disease	disease, meniere's	demyelinating disease	disease, scheuermann's	disease, caisson	jakob-creutzfeldt disease	disease, raynaud's	pellegrini-stieda disease	grave's disease	disease, osgood-schlatter's	crohn's disease	disease, pelligrini-sieda	lyme disease	disease, lyme	disease, parkinson's	parkinson's disease	collagenosis disease	inflammatory lung disease	parasitic disease, gastrointestinal	polycystic kidney disease	kidney: cystic diseases of	brain, disease due to trauma	renal disease: atherosclerotic	heart disease: beriberi	pulmonary: vascular disease	hyperthyroid heart disease	peripheral vascular disease	rheumatic heart disease	reactive airway disease	bronchi and trachea, diseases of	heart disease: valvular	vascular disease, pulmonary	lymphogranulomatosis (hodgkin's disease)	renal disease: amyloid	renal disease: vasculitis	motor neuron disease	caisson disease of bones	renal disease: glycosuria	auditory canal, disease of	cerebellar degenerative disease	renal disease: diabetic	coronary heart disease	vulva, disease or injury of	hypoadrenia (addison's disease)	disease, hansen's (leprosy)	obstructive pulmonary disease, chronic	heart disease: rheumatic	cardiovascular disease, hypertensive	kidney: polycystic disease	airway disease, reactive	atherosclerotic renal disease	hypertensive heart disease	heart disease: arterioscerotic	heart disease: hyperthyroid	beriberi heart disease	hansen's disease (leprosy)	leprosy (hansen's disease)	vagina, disease or injury of	bones, caisson disease of	hypertensive cardiovascular disease	inflammatory duodenal disease	heart disease: hypertensive	valvular heart disease	intervertebral disc disease	hypertensive vascular disease	pulmonary: disease, chronic obstructive	polycystic ovary disease	cervix, disease or injury of	chronic obstructive pulmonary disease (copd)	peripheral arterial occlusive disease	arteriosclerotic heart disease (ashd)	disease, marie-strumpell (ankylosing spondylitis)	central nervous system disease	uremic medullary cystic disease	gastroesophageal reflux disease (gerd)	buergers disease (thrombo-angiitis obliterans)	pelvic inflammatory disease (pid)	cad (coronary artery disease)	ovary: disease, injury, or adhesions of	ascites (a finding, not a disease)	disease, paget's (osteitis deformans)	metatarsalgia, anterior (morton's disease)	renal disease: cortical necrosis	uterus: disease, injury, or adhesions of	renal disease: chronic, requiring dialysis	disease, buerger's (thrombo-angiitis obliterans)	gerd (gastroesophageal reflux disease)	degenerative joint disease (djd)	morton's disease (morton's metatarsalgia)	parasitic diseases, not otherwise classified	renal disease: tubular disorders	disease, parasitic, otherwise not specified	degenerative disc disease (ddd)	paget's disease (osteitis deformans)	ashd (arterioscerotic heart disease)	coronary artery disease (cad)	renal disease: tubular acidosis (aminoaciduria)	fallopian tube, disease, injury or adhesions of	von recklinghausen's disease (neurofibromatosis type i)	copd (chronic obstructive pulmonary disease)	renal disease: sickle cell anemia	hypofunction, adrenal cortex (addison's disease)	renal disease: systemic lupus erythematosus	adrenal cortical hypofunction (addison's disease)	cor pulmonale (secondary heart disease)	chronic renal disease requiring regular dialysis	addison's disease (adrenal cortical hypofunction)	amyotrophic lateral sclerosis (lou gehrig's disease)	lou gehrig's disease (amyotrophic lateral sclerosis, als)	mental disorders: delirium, dementia, amnestic & cognitive disorders: dementia: due to other neurologic/general medical conditions (endocrine/metabolic disorders, picks disease, brain tumors, etc.) or substance-induced (drugs, alcohol, poisons)
Fracture subluxation of wrist	wrist fracture, healed	fracture, residuals of: wrist	jaw, fracture of	nasal fracture	ganglion, wrist	replacement: wrist	vertebra fracture	toes, fracture of	wrist, ankylosis of	lens, subluxated	fracture, residuals of: skull	fracture, residuals of: spine	fracture, residuals of: toes	fracture, residuals of: nose	fracture, residuals of: hip	fracture, residuals of: ulna	fracture, residuals of: finger	fracture, residuals of: femur	fracture, residuals of: fibula	impairment: wrist, supination	fracture, residuals of: ankle	fracture, residuals of: sternum	fracture, vertebra, residuals of	wrist replacement (prosthesis)	fracture, residuals of: tibia	impairment: wrist, pronation	wrist, limitation of motion	fracture, residuals of: clavicle	limitation of motion: wrist	fracture, residuals of: radius	fracture, residuals of: vertebra	fracture, residuals of: humerus	fracture, residuals of: knee	fracture, residuals of: calcaneus	fracture, residuals of: elbow	fracture, residuals of: rib	fracture, residuals of: pelvis	marfan's syndrome with lens subluxation	fracture, residuals of: cervical spine	fracture, residuals of: carpal navicular bone	fracture, vertebra, compression, with hypertrophic arthritis	fracture, residuals of: os calcis or astragalus	fracture, residuals of: compression type, lumbar vertebra	fracture, residuals of: skull with neuro residuals
First degree burn	burns	burn scar(s) or scar(s) due to other causes, not of the head, face, or neck, that are not associated with underlying soft tissue damage	burn scar(s) or scar(s) due to other causes, not of the head, face, or neck, that are associated with underlying soft tissue damage
Rupture of patellar tendon	diaphragm, rupture	ruptured diaphragm	ruptured bladder	bladder, ruptured	calcified tendonitis	tendonitis (or, tendinitis)	clear cell sarcoma of tendons and aponeuroses
Rheumatoid arthritis	rheumatoid arthritis (atrophic)	arthritis, rheumatoid (atrophic)	arthritis, other types	arthritis, psoriatic	arthritis, pneumococcic	arthritis, trauma, due to	arthritis, gonorrheal	arthritis, syphilitic	typhoid arthritis	psoriatic arthritis	pneumococcic arthritis	gonorrheal arthritis	arthritis, streptococcic	traumatic arthritis	arthritis, typhoid	arthritis, atrophic (rheumatoid)	arthritis, not otherwise specified	arthritis, degenerative, hypertrophic or osteoarthritis	fracture, vertebra, compression, with hypertrophic arthritis
Gout	gout	arthritis, other types	hyperuricemia, residual gout	arthritis, psoriatic	arthritis, pneumococcic	arthritis, trauma, due to	arthritis, gonorrheal	arthritis, syphilitic	typhoid arthritis	psoriatic arthritis	pneumococcic arthritis	gonorrheal arthritis	arthritis, streptococcic	traumatic arthritis	arthritis, typhoid	arthritis, atrophic (rheumatoid)	rheumatoid arthritis (atrophic)	arthritis, rheumatoid (atrophic)	arthritis, not otherwise specified	arthritis, degenerative, hypertrophic or osteoarthritis	fracture, vertebra, compression, with hypertrophic arthritis
Polyp of colon	colon, hypertonic	polyp: rectal	colon cancer	nasal polyps	polyp: kidney	carcinoma: colon	polyp: nose	colon syndrome, irritable	irritable colon syndrome	polyp: vocal cord
Osteoarthritis of knee	osteoarthritis	knee: meniscectomy	knee: ankylosis of	replacement: knee	contusion, knee	hypotonic, ligaments, knees	knee: other impairment with instability	varus deformity, knee	knee: residuals of injury	fracture, residuals of: knee	knee: internal derangement	impairment: knee (other)	knee: replacement (prosthesis)	arthritis, degenerative, hypertrophic or osteoarthritis	meniscectomy, knee, po residuals
Recurrent rectal polyp	polyp: rectal	incontinence, rectal	nasal polyps	polyp: kidney	carcinoma: rectal	polyp: nose	dislocation, shoulder, recurrent	polyp: vocal cord
Brain damage - traumatic	brain syndrome, assoc. with brain trauma	brain hemorrhage	thrombosis, brain	chronic brain syndrome	brain, abscess of	trauma, brain	cataract, traumatic	brain cancer	brain, thrombosis of	brain embolism	carcinoma: brain	traumatic encephalopathy	traumatic arthritis	abscess, brain	organic brain syndrome	epilepsy: post traumatic	aneurysm, arteriovenous, traumatic	brain syndrome, acute	benign neoplasms of the brain	brain trauma, residuals of	arteriovenous aneurysm, traumatic	brain tumor, malignant	hemothorax, traumatic, residuals of	embolism, brain vessels	brain, disease due to trauma	brain, vessels, hemorrhage from	brain, vessels, thrombosis of	brain tumor, benign	brain tumor, metastatic	metastatic brain tumor	brain syndrome, unknown etiology	hemorrhage, brain vessels	brain, vessels, embolism of	encephalopathy, post traumatic	acute brain syndrome	dyslipidemia (dyslipidosis) - not a disability	brain, new growths of, benign	new growths, benign: brain	benign new growths of the brain	growths, new, benign: brain	brain syndrome assoc. with alcoholism	brain syndrome, chronic (unknown etiology)	brain, benign new growths of	growths, new, malignant: brain	brain, new growths of, malignant	new growths, malignant*: brain	chest wall defect, traumatic	malignant new growth of: brain	brain, malignant new growths of	brain syndrome assoc. with intracranial infection	thrombosis, brain, internal carotid artery	brain & central nervous system, tumors of the	brain syndrome assoc. with cns syphilis	brain trauma, residuals with headaches only	brain syndrome assoc. with circulatory disturbance	brain syndrome assoc. with cerebral arteriosclerosis	brain syndrome assoc. with intracranial neoplasm	brain syndrome assoc. with metabolic disturbance	brain syndrome assoc. with convulsive disorder	traumatic chest wall defect, pneumothorax, hernia, etc	chronic myelogenous leukemia (cml - chronic myeloid leukemia or chronic granulocytic leukemia)	burn scar(s) or scar(s) due to other causes, not of the head, face, or neck, that are associated with underlying soft tissue damage	burn scar(s) or scar(s) due to other causes, not of the head, face, or neck, that are not associated with underlying soft tissue damage	mental disorders: delirium, dementia, amnestic & cognitive disorders: dementia: due to other neurologic/general medical conditions (endocrine/metabolic disorders, picks disease, brain tumors, etc.) or substance-induced (drugs, alcohol, poisons)
Smokes tobacco daily
Escherichia coli urinary tract infection	carcinoma: urinary tract	pharynx, infected	fungus infection	dementia due infection	treponemal infections	incontinence, urinary	mental disorders: delirium, dementia, amnestic & cognitive disorders: dementia: due to infection (hiv infection, syphilis, or other systemic or intracranial infections)	diverticula of urinary bladder	urinary frequency with pyuria	dementia due to other intracranial infection	dementia due to other systemic infection	feet, infection and ulcers of	carcinoma: bladder, urinary	bladder cancer, urinary	hepatitis c infection	carcinoma: urinary bladder	hepatitis b infection	dementia due to hiv infection	mycobacterial intracellular infection	intestinal parasitic infection	brain syndrome assoc. with intracranial infection	prostate gland: injuries, infections, hypertrophy
Sprain of wrist	ganglion, wrist	wrist, ankylosis of	replacement: wrist	impairment: wrist, pronation	wrist fracture, healed	fracture, residuals of: wrist	wrist, limitation of motion	impairment: wrist, supination	wrist replacement (prosthesis)	limitation of motion: wrist	whiplash injury- rate as sprain or lom
Atopic dermatitis	cellulitis with dermatitis	dermatitis: eczematoid	dermatitis: atrophic	dermatitis: neuro-	dermatitis: seborrheic	seborrheic dermatitis	dermatitis: ulcerative	dermatitis: acneform	dermatitis: contact	erythema toxicus with dermatitis
Seasonal allergic rhinitis	rhinitis: allergic	vasomotor or allergic rhinitis	allergic or vasomotor rhinitis	bacterial rhinitis	rhinitis: vasomotor	rhinitis: bacterial	rhinitis: granulomatous	rhinosinusitis, allergic	sinusitis: allergic	granulomatous rhinitis	hypersensitivity pneumonitis (extrinsic allergic alveolitis)
Opioid abuse (disorder)	drugs or alcohol, dementia resulting from abuse of	alcohol or drugs, dementia resulting from abuse of	granuloma, talc (assoc. with iv heroin abuse)
Malignant neoplasm of breast (disorder)	breast, malignant neoplasm of the	malignant neoplasms of the breast	malignant neoplasm, gynecological system or breast	benign neoplasms of the breast	gynecological system neoplasms, malignant	genitourinary system neoplasms, malignant	growths, new, malignant: breast	malignant neoplasms of the hard and soft tissue	neoplasms, malignant*: gynecological system or breast	malignant new growth of: gynecological system or breast	pineloma, malignant	breast cancer	teratoma, malignant	fibroadenoma, breast	carcinoma: breast	breast, surgery of	hemangioma, malignant, of esophagus	breast injury (male)	benign neoplasms of the brain	brain tumor, malignant	pheochromocytoma (benign or malignant)	muscle growths, malignant	growths, new, malignant: respiratory	growths, new, malignant: muscle	new growths, benign: breast	bones, malignant new growths of	benign neoplasms, genitourinary system	bones, new growths of, malignant	growths, new, malignant: bones	malignant new growth of: skin	growths, new, malignant: brain	brain, new growths of, malignant	malignant new growth of: ear	neoplasms, malignant*: genitourinary system	benign neoplasms of the respiratory system	neoplasms, benign: endocrine system	new growths, malignant*: breast	malignant new growth of: brain	genitourinary system neoplasms, benign	brain, malignant new growths of	growths, new, malignant: skin	neoplasms, benign: genitourinary system	growths, new, benign: breast	malignant new growth of: eyeball	neoplasms, malignant*: endocrine system	growths, new, malignant: ear	growths, new, malignant: eyeball only	removal (see also surgery): breast	neoplasms, benign: gynecological system 	brain syndrome assoc. with intracranial neoplasm	malignant new growth of: spinal cord	growths, new, malignant: gynecological system	malignant new growth of: digestive system	growths, new, malignant: genitourinary system	benign neoplasms of the hard and soft tissue	benign neoplasms, gynecological system 	growths, new, malignant: spinal cord	growths, new, malignant: digestive system	growths, new, malignant: endocrine system	neoplasms, malignant*: respiratory system, exclusive of skin growths
Injury of anterior cruciate ligament	muscle injury, see injury, muscle.	injury: foot	pharynx, injuries to	injury: spleen	lips, injuries to	injury: liver	bladder, injury of	injury: mouth	anterior poliomyelitis	injury: larynx	injury: bladder	injury: gallbladder	injury: pharynx	injury: prostate	shoulder injury	injury: sacroiliac	mouth, injuries of	poliomyelitis, anterior	buttocks, injury	injury: lips	cold injuries, residuals of	vulva, disease or injury of	injury: muscle: facial	knee: residuals of injury	breast injury (male)	eye, injury of, unhealed	injury: pleural cavity	vagina, disease or injury of	facial muscles, injury	hypotonic, ligaments, knees	gall bladder, injury of	injury: stomach, residuals	sacroiliac injury or weakness	injury: eye, unhealed.	cervix, disease or injury of	uterus: disease, injury, or adhesions of	neuritis: peripheral: anterior crural	ovary: disease, injury, or adhesions of	neuritis: peripheral: anterior tibial	metatarsalgia, anterior (morton's disease)	injury: tongue, whole or part	paralysis, nerve: peripheral: anterior tibial	neuralgia: peripheral nerves: anterior tibial	carcinoma: epidermoid, anterior tonsillar piliar	shrapnel injury (depending on depth)	fallopian tube, disease, injury or adhesions of	injury: muscle: groups i to xxiii	neuralgia: peripheral nerves: anterior crural	prostate gland: injuries, infections, hypertrophy	paralysis, nerve: peripheral: anterior crural	scalenus anticus syndrome (also known as anterior scalene muscle)
Laceration of forearm	laceration, face and neck	limitation of extension: forearm	forearm, limitation of extention	forearm, limitation of flexion	limitation of flexion: forearm	limitation of flexion and extension, forearm	laceration, except face and neck	forearm, limitation of extention and flexion
Myocardial Infarction	infarction, myocardial	myocardial infarction	anteroseptal infarction	mi (myocardial infarction)	cerebral infarction, residuals
History of myocardial infarction (situation)	infarction, myocardial	myocardial infarction	anteroseptal infarction	mi (myocardial infarction)	cerebral infarction, residuals
Fracture of ankle	fracture, residuals of: ankle	jaw, fracture of	nasal fracture	pseudoarthrodesis, ankle	vertebra fracture	toes, fracture of	replacement: ankle	ankle, ankylosis of	fracture, residuals of: skull	fracture, residuals of: spine	limitation of motion: ankle	fracture, residuals of: toes	fracture, residuals of: nose	fracture, residuals of: hip	fracture, residuals of: ulna	fracture, residuals of: finger	fracture, residuals of: femur	fracture, residuals of: fibula	fracture, residuals of: sternum	fracture, vertebra, residuals of	fracture, residuals of: tibia	wrist fracture, healed	ankle replacement (prosthesis)	fracture, residuals of: clavicle	fracture, residuals of: radius	fracture, residuals of: wrist	fracture, residuals of: vertebra	fracture, residuals of: humerus	fracture, residuals of: knee	fracture, residuals of: calcaneus	fracture, residuals of: elbow	fracture, residuals of: rib	ankle, limitation of motion	fracture, residuals of: pelvis	fracture, residuals of: cervical spine	fracture, residuals of: os calcis or astragalus	fracture, residuals of: compression type, lumbar vertebra	fracture, residuals of: carpal navicular bone	fracture, vertebra, compression, with hypertrophic arthritis	fracture, residuals of: skull with neuro residuals
Rupture of appendix	diaphragm, rupture	bladder, ruptured	ruptured bladder	ruptured diaphragm
