Hypertension	hypertension essential	hypertension, with cardiomegaly	tachycardia: with hypertension	arterial hypertension	hypertension, portal	hypertension, tachycardic	diastolic hypertension	hypertension, with arteriosclerosis	hypertension, diastolic	portal hypertension	hypertension, systolic	intraocular hypertension	hypertension, arterial	hypertensive cardiovascular disease	heart disease: hypertensive	cardiovascular disease, hypertensive	hypertensive heart disease	hypertensive vascular disease	mitral insufficieny with pulmonary hypertension	heart failure, congestive with arterial hypertension	congestive heart failure, with arterial hypertension
Prediabetes
Anemia (disorder)	pernicious anemia	aplastic anemia	microcytic anemia	megaloblastic anemia	anemia: sickle cell	iron deficiency anemia	sickle cell anemia	gastrectomy, po with anemia	pernicious anemia (b12)	acquired hemolytic anemia	renal disease: sickle cell anemia
Miscarriage in first trimester
Osteoarthritis of hip	osteoarthritis	hip, replacement	replacement: hip	flail hip	hip, flail	fracture, residuals of: hip	hip replacement (prosthesis)	arthritis, degenerative, hypertrophic or osteoarthritis
Viral sinusitis (disorder)	sinusitis: antral	sinusitis: ethmoid	sinusitis: frontal	hepatitis, viral	sinusitis: sphenoid	sinusitis: maxillary	sinusitis: pansinusitis	maxillary sinusitis	sinusitis: allergic
Acute bacterial sinusitis (disorder)	sinusitis: antral	sinusitis: ethmoid	sinusitis: frontal	bacterial rhinitis	rhinitis: bacterial	sinusitis: sphenoid	sinusitis: maxillary	bacterial endocarditis	sinusitis: pansinusitis	maxillary sinusitis	sinusitis: allergic	osteomyelitis: acute, subacute or chronic	leukemia, acute nonlymphocytic	nonlymphocytic leukemia, acute	brain syndrome, acute	acute nonlymphocytic leukemia	acute brain syndrome	acute and subacute peripheral neuropathy
Chronic sinusitis (disorder)	sinusitis: antral	sinusitis: ethmoid	sinusitis: frontal	sinusitis: sphenoid	sinusitis: maxillary	sinusitis: pansinusitis	maxillary sinusitis	sinusitis: allergic
Sprain of ankle	pseudoarthrodesis, ankle	replacement: ankle	ankle, ankylosis of	limitation of motion: ankle	fracture, residuals of: ankle	ankle replacement (prosthesis)	ankle, limitation of motion	whiplash injury- rate as sprain or lom
Fracture of clavicle	fracture, residuals of: clavicle	jaw, fracture of	nasal fracture	clavicle, malunion	impairment: clavicle	vertebra fracture	toes, fracture of	malunion: clavicle	fracture, residuals of: skull	fracture, residuals of: spine	fracture, residuals of: toes	fracture, residuals of: nose	scapula or clavicle, impairment of	fracture, residuals of: hip	fracture, residuals of: ulna	fracture, residuals of: finger	fracture, residuals of: femur	fracture, residuals of: fibula	fracture, residuals of: ankle	fracture, residuals of: sternum	fracture, vertebra, residuals of	fracture, residuals of: tibia	wrist fracture, healed	clavicle or scapula, impairment of	fracture, residuals of: radius	fracture, residuals of: wrist	fracture, residuals of: vertebra	fracture, residuals of: humerus	fracture, residuals of: knee	fracture, residuals of: calcaneus	fracture, residuals of: elbow	fracture, residuals of: rib	fracture, residuals of: pelvis	fracture, residuals of: cervical spine	fracture, residuals of: os calcis or astragalus	fracture, residuals of: compression type, lumbar vertebra	fracture, residuals of: carpal navicular bone	fracture, vertebra, compression, with hypertrophic arthritis	fracture, residuals of: skull with neuro residuals
Otitis media	otitis media: chronic nonsuppurative (serous otitis media)	otitis media: suppurative	otitis media: catarrhal	otitis externa	otitis interna	external otitis
Body mass index 30+ - obesity (finding)	obesity	exogenous obesity	dyslipidemia (dyslipidosis) - not a disability	chronic myelogenous leukemia (cml - chronic myeloid leukemia or chronic granulocytic leukemia)	teeth, loss of, due to loss of substance of body of maxilla or mandible without loss of continuity
Diabetes	diabetes mellitus	diabetes insipidus	diabetes mellitus	retinopathy, diabetic	renal disease: diabetic	diabetes insipidus	retinopathy, diabetic	renal disease: diabetic
Hypertriglyceridemia (disorder)
Metabolic syndrome X (disorder)	brain syndrome assoc. with metabolic disturbance	reiter's syndrome	frolich's syndrome	bartter's syndrome	morgagni-adams-stokes syndrome	chronic brain syndrome	myelodysplastic syndromes	fatigue syndrome, chronic	cushing's syndrome	hypereosinophilic syndrome	ellison-zollinger syndrome	wernicke's syndrome	hypoventilation syndrome	extrapyramidal syndrome	wolf-parkinson-white syndrome	chronic fatigue syndrome	zollinger-ellison syndrome	pluriglandular syndrome	organic brain syndrome	brain syndrome, acute	post gastrectomy syndrome	irritable colon syndrome	irritable bowel syndrome	carpal tunnel syndrome	hyperpituitarism, with cushing's syndrome	korsakoff's psychosis or syndrome	post concussion syndrome	brain syndrome, unknown etiology	colon syndrome, irritable	functional bowel syndrome	acute brain syndrome	marfan's syndrome with lens subluxation	rendu-osler-weber syndrome with gi bleeding	endolymphatic hydrops (meniere's syndrome)	osler-weber-rendu syndrome with gi bleeding	meniere's syndrome (endolymphatic hydrops)	post-phlebitic syndrome, any etiology	brain syndrome assoc. with alcoholism	brain syndrome, chronic (unknown etiology)	malabsorption syndrome secondary to sprue	fanconi's syndrome (renal tubular disorder)	brain syndrome assoc. with intracranial infection	brain syndrome assoc. with cns syphilis	brain syndrome assoc. with circulatory disturbance	brain syndrome assoc. with cerebral arteriosclerosis	brain syndrome assoc. with intracranial neoplasm	brain syndrome assoc. with convulsive disorder	sleep apnea syndromes (obstructive, central, mixed)	brain syndrome, assoc. with brain trauma	scalenus anticus syndrome (also known as anterior scalene muscle)
Neuropathy due to type 2 diabetes mellitus (disorder)	diabetes mellitus	peripheral neuropathy	neuropathy, peripheral	diabetes insipidus	ulnar, neuropathy	retinopathy, diabetic	neuropathy, lower extremity	renal disease: diabetic	peripheral neuropathy (acute and subacute)	acute and subacute peripheral neuropathy	neuropathy, acoustic nerve with deafness	neuropathy, interior tibial with foot drop
Whiplash injury to neck	muscle injury, see injury, muscle.	injury: foot	pharynx, injuries to	injury: spleen	lips, injuries to	injury: liver	bladder, injury of	injury: mouth	injury: larynx	injury: bladder	injury: gallbladder	injury: pharynx	injury: prostate	shoulder injury	neck strain	injury: sacroiliac	mouth, injuries of	buttocks, injury	injury: lips	cold injuries, residuals of	vulva, disease or injury of	injury: muscle: facial	knee: residuals of injury	breast injury (male)	laceration, face and neck	eye, injury of, unhealed	injury: pleural cavity	facial muscles, injury	gall bladder, injury of	vagina, disease or injury of	injury: stomach, residuals	sacroiliac injury or weakness	injury: eye, unhealed.	cervix, disease or injury of	injury: tongue, whole or part	uterus: disease, injury, or adhesions of	laceration, except face and neck	ovary: disease, injury, or adhesions of	prostate gland: injuries, infections, hypertrophy	shrapnel injury (depending on depth)	injury: muscle: groups i to xxiii	fallopian tube, disease, injury or adhesions of	whiplash injury- rate as sprain or lom	scar or scars: disfiguring, head, face or neck	burn scar(s) or scar(s) due to other causes, not of the head, face, or neck, that are associated with underlying soft tissue damage	burn scar(s) or scar(s) due to other causes, not of the head, face, or neck, that are not associated with underlying soft tissue damage
Diabetic retinopathy associated with type II diabetes mellitus (disorder)	diabetes mellitus	retinopathy, diabetic	diabetes insipidus	renal disease: diabetic	retinopathy, central	burn scar(s) or scar(s) due to other causes, not of the head, face, or neck, that are associated with underlying soft tissue damage	burn scar(s) or scar(s) due to other causes, not of the head, face, or neck, that are not associated with underlying soft tissue damage
Acute viral pharyngitis (disorder)	pharyngitis	hepatitis, viral	osteomyelitis: acute, subacute or chronic	leukemia, acute nonlymphocytic	nonlymphocytic leukemia, acute	brain syndrome, acute	acute nonlymphocytic leukemia	acute brain syndrome	carcinoma: pharyngeal squamous cell	acute and subacute peripheral neuropathy
Nonproliferative diabetic retinopathy due to type 2 diabetes mellitus (disorder)	diabetes mellitus	retinopathy, diabetic	diabetes insipidus	renal disease: diabetic	retinopathy, central
Macular edema and retinopathy due to type 2 diabetes mellitus (disorder)	diabetes mellitus	retinopathy, diabetic	macular degeneration	diabetes insipidus	edema, angioneurotic	retinopathy, central	renal disease: diabetic	anaphalactic shock (angioneurotic edema)	angioneurotic edema (anaphalactic shock)
Acute bronchitis (disorder)	bronchitis, chronic	leukemia, acute nonlymphocytic	nonlymphocytic leukemia, acute	osteomyelitis: acute, subacute or chronic	brain syndrome, acute	acute nonlymphocytic leukemia	acute brain syndrome	acute and subacute peripheral neuropathy
Chronic obstructive bronchitis (disorder)	bronchitis, chronic	pulmonary: disease, chronic obstructive	obstructive pulmonary emphysema	obstructive pulmonary disease, chronic	chronic obstructive pulmonary disease (copd)	copd (chronic obstructive pulmonary disease)
Normal pregnancy	pregnancy, surgical complications of
Blighted ovum
Cystitis	cystitis, chronic	cystitis, interstitial	interstitial cystitis	hunner cystitis
Fetus with unknown complication	pregnancy, surgical complications of
Laceration of hand	laceration, face and neck	laceration, except face and neck	loss of use of: hands, both	loss of use of: hand, one
Hyperlipidemia	hyperlipidemia (not a disability)
Cardiac Arrest	cardiac transplantation	cardiac hypertrophy	transplant, cardiac	cardiac transplantation	transplant, cardiac	cardiac pacemaker, implantable	pacemaker, cardiac, implantable	cardiac hypertrophy	cardiac pacemaker, implantable	pacemaker, cardiac, implantable
History of cardiac arrest (situation)	transplant, cardiac	cardiac transplantation	cardiac hypertrophy	cardiac pacemaker, implantable	pacemaker, cardiac, implantable
Hyperglycemia (disorder)	hyperglycemia (not a disability)
Alcoholism	drugs or alcohol, dementia resulting from abuse of	alcohol or drugs, dementia resulting from abuse of	brain syndrome assoc. with alcoholism	drugs or alcohol, dementia resulting from abuse of	alcohol or drugs, dementia resulting from abuse of	brain syndrome assoc. with alcoholism	drugs or alcohol, dementia resulting from abuse of	alcohol or drugs, dementia resulting from abuse of	granuloma, talc (assoc. with iv heroin abuse)	mental disorders: delirium, dementia, amnestic & cognitive disorders: dementia: due to other neurologic/general medical conditions (endocrine/metabolic disorders, picks disease, brain tumors, etc.) or substance-induced (drugs, alcohol, poisons)	mental disorders: delirium, dementia, amnestic & cognitive disorders: dementia: due to other neurologic/general medical conditions (endocrine/metabolic disorders, picks disease, brain tumors, etc.) or substance-induced (drugs, alcohol, poisons)
Chronic kidney disease stage 1 (disorder)	kidney: cystic diseases of	polycystic kidney disease	kidney: polycystic disease	kidney: medullary sponge kidney	renal disease: involvment in other diseases	cardiovascular-renal disease	kidney: calculus	kidney: abcess	hodgkin's disease	tuberculosis: kidney	kidney: stones	disease, grave's	kidney: horseshoe	acneform disease	horseshoe kidney	meniere's disease	raynaud's disease	disease, morton's	disease, addison's	osgood-schlatter's disease	kidney: tuberculosis of	kidney: transplant	scheuermann's disease	disease, jakob-creutzfeldt	kidney: enlarged	skin disease	disease, meniere's	demyelinating disease	disease, scheuermann's	disease, caisson	transplant, kidney	jakob-creutzfeldt disease	carcinoma: kidney	calculus, kidney	kidney: cancer	disease, raynaud's	pellegrini-stieda disease	abscess, kidney	grave's disease	disease, osgood-schlatter's	polyp: kidney	crohn's disease	lyme disease	disease, pelligrini-sieda	disease, lyme	disease, parkinson's	parkinson's disease	collagenosis disease	medullary sponge kidney	motor neuron disease	heart disease: arterioscerotic	polycystic ovary disease	cerebellar degenerative disease	renal disease: diabetic	disease, hansen's (leprosy)	hypertensive cardiovascular disease	vascular disease, pulmonary	heart disease: hypertensive	cardiovascular disease, hypertensive	intervertebral disc disease	renal disease: amyloid	airway disease, reactive	atherosclerotic renal disease	renal disease: atherosclerotic	heart disease: hyperthyroid	hyperthyroid heart disease	rheumatic heart disease	vulva, disease or injury of	heart disease: rheumatic	heart disease: valvular	parasitic disease, gastrointestinal	kidney: removal of one	caisson disease of bones	hypertensive vascular disease	pulmonary: disease, chronic obstructive	pulmonary: vascular disease	auditory canal, disease of	leprosy (hansen's disease)	vagina, disease or injury of	cervix, disease or injury of	hypoadrenia (addison's disease)	bronchi and trachea, diseases of	inflammatory lung disease	lymphogranulomatosis (hodgkin's disease)	renal disease: vasculitis	hypertensive heart disease	beriberi heart disease	heart disease: beriberi	renal disease: glycosuria	hansen's disease (leprosy)	peripheral vascular disease	coronary heart disease	bones, caisson disease of	reactive airway disease	obstructive pulmonary disease, chronic	inflammatory duodenal disease	valvular heart disease	brain, disease due to trauma	disease, marie-strumpell (ankylosing spondylitis)	coronary artery disease (cad)	gastroesophageal reflux disease (gerd)	pelvic inflammatory disease (pid)	arteriosclerotic heart disease (ashd)	ascites (a finding, not a disease)	alzheimer's type dementia (alzheimer's disease)	central nervous system disease	uremic medullary cystic disease	uterus: disease, injury, or adhesions of	cad (coronary artery disease)	renal disease: chronic, requiring dialysis	ovary: disease, injury, or adhesions of	disease, paget's (osteitis deformans)	metatarsalgia, anterior (morton's disease)	parasitic diseases, not otherwise classified	renal disease: tubular disorders	renal disease: cortical necrosis	disease, parasitic, otherwise not specified	degenerative disc disease (ddd)	paget's disease (osteitis deformans)	dementia, alzheimer's type (alzheimer's disease)	disease, buerger's (thrombo-angiitis obliterans)	gerd (gastroesophageal reflux disease)	degenerative joint disease (djd)	buergers disease (thrombo-angiitis obliterans)	morton's disease (morton's metatarsalgia)	chronic obstructive pulmonary disease (copd)	peripheral arterial occlusive disease	ashd (arterioscerotic heart disease)	copd (chronic obstructive pulmonary disease)	renal disease: sickle cell anemia	hypofunction, adrenal cortex (addison's disease)	renal disease: systemic lupus erythematosus	adrenal cortical hypofunction (addison's disease)	cor pulmonale (secondary heart disease)	chronic renal disease requiring regular dialysis	addison's disease (adrenal cortical hypofunction)	removal (see also surgery): kidney	renal disease: tubular acidosis (aminoaciduria)	fallopian tube, disease, injury or adhesions of	von recklinghausen's disease (neurofibromatosis type i)	amyotrophic lateral sclerosis (lou gehrig's disease)	lou gehrig's disease (amyotrophic lateral sclerosis, als)	mental disorders: delirium, dementia, amnestic & cognitive disorders: dementia: due to other neurologic/general medical conditions (endocrine/metabolic disorders, picks disease, brain tumors, etc.) or substance-induced (drugs, alcohol, poisons)
Diabetic renal disease (disorder)	renal disease: diabetic	renal disease: involvment in other diseases	renal disease: atherosclerotic	renal disease: amyloid	renal disease: vasculitis	renal disease: glycosuria	atherosclerotic renal disease	renal disease: cortical necrosis	renal disease: tubular disorders	renal disease: chronic, requiring dialysis	chronic renal disease requiring regular dialysis	renal disease: tubular acidosis (aminoaciduria)	renal disease: systemic lupus erythematosus	renal disease: sickle cell anemia	disease, grave's	disease, osgood-schlatter's	acneform disease	raynaud's disease	disease, morton's	crohn's disease	disease, pelligrini-sieda	disease, parkinson's	parkinson's disease	collagenosis disease	retinopathy, diabetic	diabetes insipidus	disease, scheuermann's	jakob-creutzfeldt disease	disease, raynaud's	pellegrini-stieda disease	grave's disease	meniere's disease	disease, addison's	osgood-schlatter's disease	lyme disease	disease, lyme	scheuermann's disease	disease, jakob-creutzfeldt	cardiovascular-renal disease	carcinoma: renal	skin disease	disease, meniere's	diabetes mellitus	demyelinating disease	disease, caisson	hodgkin's disease	bones, caisson disease of	reactive airway disease	hypertensive cardiovascular disease	inflammatory duodenal disease	vascular disease, pulmonary	heart disease: hypertensive	valvular heart disease	intervertebral disc disease	motor neuron disease	polycystic ovary disease	cerebellar degenerative disease	vulva, disease or injury of	disease, hansen's (leprosy)	heart disease: rheumatic	parasitic disease, gastrointestinal	cardiovascular disease, hypertensive	polycystic kidney disease	kidney: polycystic disease	airway disease, reactive	heart disease: hyperthyroid	pulmonary: vascular disease	hyperthyroid heart disease	leprosy (hansen's disease)	vagina, disease or injury of	rheumatic heart disease	bronchi and trachea, diseases of	heart disease: valvular	lymphogranulomatosis (hodgkin's disease)	caisson disease of bones	hypertensive vascular disease	pulmonary: disease, chronic obstructive	auditory canal, disease of	cervix, disease or injury of	coronary heart disease	hypoadrenia (addison's disease)	obstructive pulmonary disease, chronic	inflammatory lung disease	kidney: cystic diseases of	brain, disease due to trauma	hypertensive heart disease	heart disease: arterioscerotic	beriberi heart disease	heart disease: beriberi	hansen's disease (leprosy)	peripheral vascular disease	uremic medullary cystic disease	morton's disease (morton's metatarsalgia)	paget's disease (osteitis deformans)	ashd (arterioscerotic heart disease)	cad (coronary artery disease)	ascites (a finding, not a disease)	buergers disease (thrombo-angiitis obliterans)	disease, paget's (osteitis deformans)	metatarsalgia, anterior (morton's disease)	chronic obstructive pulmonary disease (copd)	peripheral arterial occlusive disease	disease, marie-strumpell (ankylosing spondylitis)	dementia, alzheimer's type (alzheimer's disease)	degenerative joint disease (djd)	gastroesophageal reflux disease (gerd)	parasitic diseases, not otherwise classified	disease, parasitic, otherwise not specified	degenerative disc disease (ddd)	pelvic inflammatory disease (pid)	ovary: disease, injury, or adhesions of	coronary artery disease (cad)	alzheimer's type dementia (alzheimer's disease)	uterus: disease, injury, or adhesions of	arteriosclerotic heart disease (ashd)	disease, buerger's (thrombo-angiitis obliterans)	gerd (gastroesophageal reflux disease)	central nervous system disease	cor pulmonale (secondary heart disease)	addison's disease (adrenal cortical hypofunction)	fallopian tube, disease, injury or adhesions of	von recklinghausen's disease (neurofibromatosis type i)	copd (chronic obstructive pulmonary disease)	adrenal cortical hypofunction (addison's disease)	hypofunction, adrenal cortex (addison's disease)	disseminated intravasacular coagulation with renal cortical necrosis	intravascular coagulation (disseminated) with renal cortical necrosis	amyotrophic lateral sclerosis (lou gehrig's disease)	lou gehrig's disease (amyotrophic lateral sclerosis, als)	mental disorders: delirium, dementia, amnestic & cognitive disorders: dementia: due to other neurologic/general medical conditions (endocrine/metabolic disorders, picks disease, brain tumors, etc.) or substance-induced (drugs, alcohol, poisons)
Suspected lung cancer (situation)	lung cancer	bronchus, lung, larynx, or trachea, cancer of	abscess, lung, chronic	lung, collapsed	granuloma, lung	esophageal cancer	colon cancer	lung, blastomycosis	breast cancer	lung abscess, chronic	lung congestion	brain cancer	esophagus: cancer of	histoplasmosis of lung	bone cancer	kidney: cancer	chronic lung abscess	larynx, cancer of	eosinophilic granuloma of lung	lung mycosis, unspecified	congestion, lung, passive	inflammatory lung disease	bladder cancer, urinary	bile ducts, cancer of the	collapsed lung, permanent	mycosis, lung, unspecified	prostate gland: cancer	carcinoma: lung, bronchus, larynx, or trachea	lung, removal of (pneumonectomy), post-surgical residuals	loss of: lung (pneumonectomy), post-surgical residuals
Non-small cell lung cancer (disorder)	lung cancer	bronchus, lung, larynx, or trachea, cancer of	abscess, lung, chronic	lung, collapsed	granuloma, lung	esophageal cancer	colon cancer	lung, blastomycosis	breast cancer	lung abscess, chronic	lung congestion	brain cancer	esophagus: cancer of	histoplasmosis of lung	bone cancer	kidney: cancer	chronic lung abscess	larynx, cancer of	anemia: sickle cell	sickle cell anemia	eosinophilic granuloma of lung	lung mycosis, unspecified	congestion, lung, passive	inflammatory lung disease	hairy cell leukemia	carcinoma: basal cell	bladder cancer, urinary	bile ducts, cancer of the	collapsed lung, permanent	basal cell epithelioma	mycosis, lung, unspecified	epithelioma, basal cell	prostate gland: cancer	basal cell carcinoma	carcinoma: pharyngeal squamous cell	carcinoma: vocal cells with layryngectomy	lung, removal of (pneumonectomy), post-surgical residuals	loss of: lung (pneumonectomy), post-surgical residuals	renal disease: sickle cell anemia	clear cell sarcoma of tendons and aponeuroses	carcinoma: lung, bronchus, larynx, or trachea	leukemia, hairy cell & other b-cell leukemias	sickle cell trait (please see note under d.c. 7714 as to whether this is a ratable disability)
Non-small cell carcinoma of lung, TNM stage 1 (disorder)	carcinoma: basal cell	basal cell carcinoma	carcinoma: vocal cells with layryngectomy	carcinoma: pharyngeal squamous cell	carcinoma: peritoneal	carcinoma: prostate	carcinoma: brain	carcinoma: muscle	carcinoma: trachea	carcinoma: bronchogenic	carcinoma: breast	carcinoma: tonsil	carcinoma: liver	carcinoma: bones	carcinoma: pancreatic	carcinoma: kidney	carcinoma: stomach	carcinoma: abdominal	carcinoma: colon	carcinoma: rectal	carcinoma: skin	carcinoma: renal	carcinoma: respiratory	carcinoma: tongue	carcinoma: esophageal	carcinoma: laryngeal	carcinoma: thyroid	carcinoma: nasopharyngeal	carcinoma: rectosigmoid	anemia: sickle cell	sickle cell anemia	carcinoma: gall bladder	carcinoma: bile duct	carcinoma: urinary tract	carcinoma: bladder, urinary	carcinoma: small intestine	hairy cell leukemia	thyroid gland: carcinoma	carcinoma: lymph glands	carcinoma: urinary bladder	basal cell epithelioma	carcinoma: sacral region	epithelioma, basal cell	carcinoma: epidermoid, tongue	carcinoma: lymph nodes	carcinoma: cervical lymph gland	carcinoma: common bile duct	carcinoma: lung, bronchus, larynx, or trachea	carcinoma: epidermoid, anterior tonsillar piliar	renal disease: sickle cell anemia	clear cell sarcoma of tendons and aponeuroses	leukemia, hairy cell & other b-cell leukemias	sickle cell trait (please see note under d.c. 7714 as to whether this is a ratable disability)
Streptococcal sore throat (disorder)	bed sores	throat condition	arthritis, streptococcic
Chronic intractable migraine without aura	migraine	headaches, migraine
Chronic pain	pain disorder	leg pain	discogenic pain synrome	abdominal pain, etiology unknown	atypical chest pain	mechanical low back pain	mental disorders: somatoform disorders: pain disorder
Impacted molars
Drug overdose	drugs or alcohol, dementia resulting from abuse of	pneumonitis: pulmonary, and fibrosis, drug induced	alcohol or drugs, dementia resulting from abuse of
Perennial allergic rhinitis	rhinitis: allergic	vasomotor or allergic rhinitis	allergic or vasomotor rhinitis	bacterial rhinitis	rhinitis: vasomotor	rhinitis: bacterial	rhinitis: granulomatous	rhinosinusitis, allergic	sinusitis: allergic	granulomatous rhinitis	hypersensitivity pneumonitis (extrinsic allergic alveolitis)
Acute allergic reaction	rhinitis: allergic	rhinosinusitis, allergic	conversion reaction	sinusitis: allergic	adult situational reaction	leukemia, acute nonlymphocytic	vasomotor or allergic rhinitis	nonlymphocytic leukemia, acute	osteomyelitis: acute, subacute or chronic	situational reaction, adult	brain syndrome, acute	acute nonlymphocytic leukemia	allergic or vasomotor rhinitis	acute brain syndrome	acute and subacute peripheral neuropathy	hypersensitivity pneumonitis (extrinsic allergic alveolitis)
Sinusitis (disorder)	sinusitis: antral	sinusitis: frontal	sinusitis: ethmoid	sinusitis: sphenoid	sinusitis: maxillary	sinusitis: pansinusitis	maxillary sinusitis	sinusitis: allergic
