Seizure disorder	mental disorders: mood disorders: dysthymic disorder	mental disorders: somatoform disorders: pain disorder	mental disorders: somatoform disorders: conversion disorder	mental disorders: somatoform disorders: somatization disorder	mental disorders: mood disorders: bipolar disorder	mental disorders: dissociative disorders: depersonalization disorder	mental disorders: mood disorders: cyclothymic disorder	mental disorders: schizophrenia and other psychotic disorders: schizoaffective disorder	mental disorders: schizophrenia and other psychotic disorders: delusional disorder	mental disorders: mood disorders: major depressive disorder	mental disorders: dissociative disorders: multiple personality disorder	mental disorders: anxiety disorders: obsessive compulsive disorder	mental disorders: chronic adjustment disorder	mental disorders: anxiety disorders: panic disorder and/or agoraphobia	mental disorders: dissociative disorders: dissociative identity disorder	mental disorders: anxiety disorders: generalized anxiety disorder	mental disorders: somatoform disorders: undifferentiated somatoform disorder	mental disorders: somatoform disorders: hypochondriasis	mood disorders (see mental disorders)	somatoform disorders (see mental disorders)	mental disorders: schizophrenia and other psychotic disorders: atypical psychosis (psychotic disorder, n.o.s.)	mental disorders: schizophrenia and other psychotic disorders: psychotic disorder, n.o.s. (atypical psychosis)	adjustment disorder, chronic	conversion disorder	schizoaffective disorder	mental disorders: mood disorders: not otherwise specified	mental disorders: anxiety disorders: social phobia	mental disorders: schizophrenia and other psychotic disorders: paranoid type	cyclothymic disorder	convulsive disorder	mental disorders: schizophrenia and other psychotic disorders: undifferentiated type	mental disorders: anxiety disorders: ptsd (established)	bipolar disorder	mental disorders: schizophrenia and other psychotic disorders: other and unspecified types	mental disorders: anxiety disorders: other and unspecified neurosis	mental disorders: schizophrenia and other psychotic disorders: residual type	delusional disorder	mental disorders: schizophrenia and other psychotic disorders: catatonic type	depersonalization disorder	post-chiasmal disorders	eating disorders	bullous disorders	mental disorders: eating disorders: bulimia nervosa	chronic adjustment disorder	mental disorders: eating disorders: anorexia nervosa	pain disorder	somatization disorder	mental disorders: schizophrenia and other psychotic disorders: disorganized type	dysthymic disorder	mental disorders: anxiety disorders: not otherwise specified (nos)	mental disorders: anxiety disorders: specific (simple) phobia	mental disorders: anxiety disorders: ptsd (not yet established)	mental disorders: dissociative disorders: dissociative fugue	mental disorders: delirium, dementia, amnestic & cognitive disorders: anmesia	major depressive disorder	organic mental disorder, other	depressive disorder, major	dissociative identity disorder	post-traumatic stress disorder	generalized anxiety disorder	mental disorders: delirium, dementia, amnestic & cognitive disorders: delirium	undifferentiated somatoform disorder	obsessive compulsive disorder	henle's loop, disorders	seizures: petit mal	antisocial personality disorder	mental disorders: delirium, dementia, amnestic & cognitive disorders: dementia: organic mental disorder, other (incl. personality change due to a general medical condition)	seizures: grand mal	amnesia (amnestic disorders)	gastrointestinal disorder, functional	mental disorders: dissociative disorders: dissociative amnesia ; 9416, ยง4.130	mental disorders: delirium, dementia, amnestic & cognitive disorders: dementia: alzheimers type	mental disorders: delirium, dementia, amnestic & cognitive disorders: dementia: unknown etiology	mental disorders: delirium, dementia, amnestic & cognitive disorders: dementia: vascular	mental disorders: delirium, dementia, amnestic & cognitive disorders: dementia: due to other neurologic/general medical conditions (endocrine/metabolic disorders, picks disease, brain tumors, etc.) or substance-induced (drugs, alcohol, poisons)	mental disorders: delirium, dementia, amnestic & cognitive disorders: dementia: due to head trauma	post-traumatic stress disorder, established	aminoacidurias (renal tubular disorder)	renal disease: tubular disorders	psychotic disorder, not otherwise specified	anxiety disorder (generalized, n.o.s.)	dissociative disorder, not otherwise specified	brain syndrome assoc. with convulsive disorder	agoraphobia (panic attacks, panic disorder)	panic attacks (panic disorder, agoraphobia)	fanconi's syndrome (renal tubular disorder)	female sexual arousal disorder (fsad)	mental disorders: delirium, dementia, amnestic & cognitive disorders: dementia: due to infection (hiv infection, syphilis, or other systemic or intracranial infections)
History of single seizure (situation)	seizures: petit mal	seizures: grand mal
Epilepsy	epilepsy: psychomotor	epilepsy: diencephalic	epilepsy: petit mal	epilepsy: post traumatic	epilepsy: grand mal	epilepsy: jacksonian (focal, motor or sensory)
Chronic congestive heart failure (disorder)	heart failure, congestive	congestive heart failure (chf)	congestive heart failure, unknown etiology	heart failure, congestive with arterial hypertension	congestive heart failure, with arterial hypertension	chf (congestive heart failure)	heart transplant	lung congestion	transplant, heart	cardiomegaly, congestive	coronary heart disease	rheumatic heart disease	congestion, lung, passive	heart disease: rheumatic	heart disease: valvular	heart disease: hypertensive	glaucoma, congestive (inflammatory)	valvular heart disease	adrenal failure, insufficiency	heart valve replacement	hypertensive heart disease	heart disease: arterioscerotic	heart disease: hyperthyroid	replacement: heart valve	beriberi heart disease	heart disease: beriberi	hyperthyroid heart disease	arteriosclerotic heart disease (ashd)	ashd (arterioscerotic heart disease)	cor pulmonale (secondary heart disease)
Perennial allergic rhinitis with seasonal variation	rhinitis: allergic	vasomotor or allergic rhinitis	allergic or vasomotor rhinitis	bacterial rhinitis	rhinitis: vasomotor	rhinitis: bacterial	rhinitis: granulomatous	rhinosinusitis, allergic	sinusitis: allergic	granulomatous rhinitis	hypersensitivity pneumonitis (extrinsic allergic alveolitis)
Fracture of forearm	jaw, fracture of	nasal fracture	vertebra fracture	toes, fracture of	fracture, residuals of: skull	fracture, residuals of: spine	fracture, residuals of: toes	fracture, residuals of: nose	limitation of extension: forearm	limitation of flexion: forearm	fracture, residuals of: hip	fracture, residuals of: ulna	fracture, residuals of: finger	fracture, residuals of: femur	fracture, residuals of: fibula	fracture, residuals of: ankle	forearm, limitation of extention	fracture, residuals of: sternum	fracture, vertebra, residuals of	fracture, residuals of: tibia	wrist fracture, healed	fracture, residuals of: clavicle	fracture, residuals of: radius	fracture, residuals of: wrist	fracture, residuals of: vertebra	fracture, residuals of: humerus	fracture, residuals of: knee	fracture, residuals of: calcaneus	fracture, residuals of: elbow	fracture, residuals of: rib	forearm, limitation of flexion	fracture, residuals of: pelvis	fracture, residuals of: cervical spine	limitation of flexion and extension, forearm	forearm, limitation of extention and flexion	fracture, residuals of: os calcis or astragalus	fracture, residuals of: compression type, lumbar vertebra	fracture, residuals of: carpal navicular bone	fracture, vertebra, compression, with hypertrophic arthritis	fracture, residuals of: skull with neuro residuals
Appendicitis	appendicitis, po, cured
History of appendectomy	appendectomy	scar or scars: appendectomy
Laceration of thigh	thigh, impairment of	limitation of extension: thigh	thigh, limitation of flexion of	laceration, face and neck	limitation of flexion: thigh	meralgia paresthetiva, thigh	thigh, limitation of extension of	impairment: thigh, motion	laceration, except face and neck	neuritis: peripheral: external cutaneous, thigh	neuralgia: peripheral nerves: external cutaneous, thigh	paralysis, nerve: peripheral: external cutaneous, thigh
Concussion with loss of consciousness	concussion	teeth, loss of, due to loss of substance of body of maxilla or mandible without loss of continuity	loss of: nose, loss of part of, or scars	memory loss	loss of: eyelashes	loss of: teeth	hearing loss	loss of: memory	loss of: eyebrows	auricle, loss of	eyelashes, loss of, complete	loss of: smell, sense of	loss of: mandible, one-half	coronoid process, loss of	loss of: auricle, or deformity	loss of: mandible, complete	eyebrows, loss of, complete	mandible: loss of one-half	deafness (hearing loss)	loss of: condyloid process	loss of: coronoid process	cerebral concussion, residuals	post concussion syndrome	loss of: taste, sense of	mandible: loss of, complete	eyelid, loss of portion of	loss of: skull, part	loss of tongue, all or part	smell, loss of sense of, complete	maxilla: loss of half or less	loss of use of: foot, one	loss of use of: hands, both	loss of: ramus, all or part	abnormal weight loss, etiology unknown	loss of use of: hand, one	tongue, loss of whole or part	ramus, loss of whole or part	nose, loss of part of, or scars	loss of: maxilla, half or less	eyes, loss, anatomical, both	eye, loss, anatomical, one	taste, loss of sense of, complete	loss of: pulmonary lobe (lobectomy)	loss of use of: feet, both	loss of: palate, hard, half or less	loss of: lung (pneumonectomy), post-surgical residuals	hard palate, loss of half or more	loss of: maxilla, more than half	maxilla: loss of more than half	ramus, loss of less than one-half the substance of	condyloid process, loss of, one or both sides	eye, anatomical loss (enucleation), see blindness	loss of: palate, hard, less than half	hard palate, loss of less than half	loss of: ramus, less than one-half substance
Traumatic brain injury (disorder)	muscle injury, see injury, muscle.	brain syndrome, assoc. with brain trauma	injury: mouth	chronic brain syndrome	injury: larynx	brain embolism	injury: sacroiliac	abscess, brain	pharynx, injuries to	lips, injuries to	thrombosis, brain	cataract, traumatic	brain cancer	carcinoma: brain	traumatic encephalopathy	injury: prostate	traumatic arthritis	mouth, injuries of	injury: foot	injury: liver	bladder, injury of	brain, abscess of	injury: bladder	injury: gallbladder	shoulder injury	trauma, brain	buttocks, injury	injury: spleen	brain hemorrhage	brain, thrombosis of	injury: pharynx	injury: lips	organic brain syndrome	aneurysm, arteriovenous, traumatic	eye, injury of, unhealed	embolism, brain vessels	brain, vessels, thrombosis of	brain tumor, benign	injury: stomach, residuals	metastatic brain tumor	hemorrhage, brain vessels	sacroiliac injury or weakness	cold injuries, residuals of	vulva, disease or injury of	brain syndrome, acute	benign neoplasms of the brain	arteriovenous aneurysm, traumatic	brain tumor, malignant	facial muscles, injury	brain tumor, metastatic	gall bladder, injury of	brain syndrome, unknown etiology	encephalopathy, post traumatic	vagina, disease or injury of	acute brain syndrome	injury: muscle: facial	knee: residuals of injury	hemothorax, traumatic, residuals of	brain, vessels, hemorrhage from	cervix, disease or injury of	breast injury (male)	brain trauma, residuals of	injury: pleural cavity	brain, disease due to trauma	brain, vessels, embolism of	epilepsy: post traumatic	injury: eye, unhealed.	injury: tongue, whole or part	benign new growths of the brain	growths, new, malignant: brain	new growths, malignant*: brain	chest wall defect, traumatic	new growths, benign: brain	brain syndrome assoc. with alcoholism	brain syndrome, chronic (unknown etiology)	brain, new growths of, malignant	ovary: disease, injury, or adhesions of	brain, malignant new growths of	brain, new growths of, benign	growths, new, benign: brain	uterus: disease, injury, or adhesions of	brain, benign new growths of	malignant new growth of: brain	thrombosis, brain, internal carotid artery	brain syndrome assoc. with cns syphilis	brain syndrome assoc. with convulsive disorder	brain & central nervous system, tumors of the	brain syndrome assoc. with cerebral arteriosclerosis	brain syndrome assoc. with metabolic disturbance	injury: muscle: groups i to xxiii	fallopian tube, disease, injury or adhesions of	brain syndrome assoc. with intracranial infection	prostate gland: injuries, infections, hypertrophy	brain syndrome assoc. with circulatory disturbance	brain trauma, residuals with headaches only	shrapnel injury (depending on depth)	brain syndrome assoc. with intracranial neoplasm	traumatic chest wall defect, pneumothorax, hernia, etc	mental disorders: delirium, dementia, amnestic & cognitive disorders: dementia: due to other neurologic/general medical conditions (endocrine/metabolic disorders, picks disease, brain tumors, etc.) or substance-induced (drugs, alcohol, poisons)
Pulmonary emphysema (disorder)	emphysema, pulmonary	obstructive pulmonary emphysema	fibrosis, pulmonary	pulmonary: sarcoidosis	cyst, pulmonary	pulmonary: pneumonitis, radiation-induced	obstructive pulmonary disease, chronic	vascular disease, pulmonary	tuberculosis: pulmonary: chronic: active	pulmonary: tuberculosis, active	pulmonary: tuberculosis, inactive	pulmonary: alveolar proteinosis	pulmonary: pneumonitis, drug-induced	active pulmonary tuberculosis	pulmonary: disease, chronic obstructive	pulmonary: vascular disease	tuberculosis: pulmonary: chronic: inactive	chronic obstructive pulmonary disease (copd)	tuberculosis: pulmonary: inactive: minimal	tuberculosis: pulmonary: active: minimal	loss of: pulmonary lobe (lobectomy)	mitral insufficieny with pulmonary hypertension	drug-induced pulmonary pneumonitis and fibrosis	lobectomy, pulmonary, post-surgical residuals	tuberculosis: pulmonary: active: far advanced	tuberculosis: pulmonary: inactive: moderately advanced	copd (chronic obstructive pulmonary disease)	tuberculosis: pulmonary: active: moderately advanced	pneumonitis: pulmonary, and fibrosis, drug induced	tuberculosis: pulmonary: inactive: advancement unspecified	pulmonary: tuberculosis, entitled on 08-19-68	tuberculosis: pulmonary: active: advancement unspecified	tuberculosis: pulmonary: inactive: far advanced	radiation induced pulmonary pneumonitis and fibrosis
Atrial Fibrillation	tachycardia: atrial	fibrillation, auricular, permanent	paroxysmal atrial tachycardia	fibrillation, auricular, paroxysmal
Neoplasm of prostate	prostatitis	calculus, prostate	carcinoma: prostate	adenocarcinoma, prostate	injury: prostate	hypertophy, prostatic	resection: prostate	benign neoplasms of the breast	breast, malignant neoplasm of the	prostate gland: adenocarcinoma	benign neoplasms of the brain	malignant neoplasms of the breast	prostate gland: cancer	prostate gland: calculus	prostate gland: enlarged	neoplasms, benign: genitourinary system	gynecological system neoplasms, malignant	benign prostatic hypertrophy (bph)	neoplasms, malignant*: endocrine system	genitourinary system neoplasms, malignant	benign neoplasms, genitourinary system	turp (transurethral resection of the prostate)	neoplasms, malignant*: genitourinary system	bph (benign prostatic hypertrophy)	benign neoplasms of the respiratory system	neoplasms, benign: endocrine system	genitourinary system neoplasms, benign	brain syndrome assoc. with intracranial neoplasm	neoplasms, benign: gynecological system 	malignant neoplasm, gynecological system or breast	malignant neoplasms of the hard and soft tissue	removal (see also surgery): prostate	neoplasms, malignant*: gynecological system or breast	benign neoplasms of the hard and soft tissue	prostate gland: injuries, infections, hypertrophy	benign neoplasms, gynecological system 	neoplasms, malignant*: respiratory system, exclusive of skin growths
Carcinoma in situ of prostate (disorder)	carcinoma: prostate	prostatitis	carcinoma: renal	carcinoma: respiratory	carcinoma: tongue	carcinoma: esophageal	carcinoma: laryngeal	calculus, prostate	carcinoma: thyroid	carcinoma: nasopharyngeal	carcinoma: rectosigmoid	carcinoma: peritoneal	adenocarcinoma, prostate	carcinoma: brain	carcinoma: muscle	carcinoma: trachea	carcinoma: bronchogenic	injury: prostate	carcinoma: breast	carcinoma: rectal	carcinoma: tonsil	carcinoma: liver	carcinoma: bones	carcinoma: pancreatic	carcinoma: kidney	carcinoma: stomach	carcinoma: abdominal	carcinoma: colon	hypertophy, prostatic	resection: prostate	carcinoma: skin	carcinoma: lymph glands	carcinoma: urinary bladder	carcinoma: sacral region	prostate gland: cancer	carcinoma: epidermoid, tongue	prostate gland: calculus	prostate gland: enlarged	basal cell carcinoma	carcinoma: lymph nodes	carcinoma: gall bladder	carcinoma: bile duct	carcinoma: urinary tract	carcinoma: bladder, urinary	prostate gland: adenocarcinoma	carcinoma: basal cell	carcinoma: small intestine	thyroid gland: carcinoma	carcinoma: pharyngeal squamous cell	bph (benign prostatic hypertrophy)	turp (transurethral resection of the prostate)	carcinoma: vocal cells with layryngectomy	carcinoma: cervical lymph gland	benign prostatic hypertrophy (bph)	carcinoma: common bile duct	carcinoma: epidermoid, anterior tonsillar piliar	removal (see also surgery): prostate	prostate gland: injuries, infections, hypertrophy	carcinoma: lung, bronchus, larynx, or trachea
Concussion with no loss of consciousness	concussion	teeth, loss of, due to loss of substance of body of maxilla or mandible without loss of continuity	loss of: nose, loss of part of, or scars	memory loss	loss of: eyelashes	loss of: teeth	hearing loss	loss of: memory	loss of: eyebrows	auricle, loss of	loss of: coronoid process	cerebral concussion, residuals	post concussion syndrome	loss of: taste, sense of	mandible: loss of, complete	eyelid, loss of portion of	loss of: skull, part	eyelashes, loss of, complete	loss of: mandible, one-half	coronoid process, loss of	loss of: smell, sense of	loss of: auricle, or deformity	loss of: mandible, complete	eyebrows, loss of, complete	mandible: loss of one-half	deafness (hearing loss)	loss of: condyloid process	loss of tongue, all or part	smell, loss of sense of, complete	maxilla: loss of half or less	loss of use of: foot, one	loss of use of: hands, both	loss of: ramus, all or part	abnormal weight loss, etiology unknown	loss of use of: hand, one	nose, loss of part of, or scars	ramus, loss of whole or part	tongue, loss of whole or part	loss of: maxilla, half or less	eyes, loss, anatomical, both	eye, loss, anatomical, one	taste, loss of sense of, complete	loss of: pulmonary lobe (lobectomy)	loss of use of: feet, both	loss of: palate, hard, half or less	loss of: lung (pneumonectomy), post-surgical residuals	hard palate, loss of half or more	loss of: maxilla, more than half	maxilla: loss of more than half	ramus, loss of less than one-half the substance of	condyloid process, loss of, one or both sides	eye, anatomical loss (enucleation), see blindness	hard palate, loss of less than half	loss of: palate, hard, less than half	loss of: ramus, less than one-half substance	lymphadenoma (term no longer in technical use)
Laceration of foot	foot ulcer	injury: foot	calluses, foot	foot fungus	trench foot	club foot	foot drop	weak foot	immersion foot	athlete's foot	ulcer: foot	drop foot	laceration, face and neck	laceration, except face and neck	limitation of extension: leg and foot	loss of use of: foot, one	claw foot (pes cavus), acquired	neuropathy, interior tibial with foot drop	jungle rot of feet (trench foot)
Antepartum eclampsia
Coronary Heart Disease	coronary heart disease	heart disease: rheumatic	hypertensive heart disease	heart disease: arterioscerotic	heart disease: hyperthyroid	beriberi heart disease	heart disease: hypertensive	valvular heart disease	heart disease: beriberi	hyperthyroid heart disease	rheumatic heart disease	heart disease: valvular	coronary artery disease (cad)	arteriosclerotic heart disease (ashd)	ashd (arterioscerotic heart disease)	cor pulmonale (secondary heart disease)	renal disease: involvment in other diseases	cardiovascular-renal disease	transplant, heart	hodgkin's disease	disease, grave's	acneform disease	meniere's disease	raynaud's disease	heart transplant	disease, morton's	disease, addison's	osgood-schlatter's disease	scheuermann's disease	disease, jakob-creutzfeldt	skin disease	disease, meniere's	demyelinating disease	disease, scheuermann's	disease, caisson	jakob-creutzfeldt disease	disease, raynaud's	pellegrini-stieda disease	grave's disease	disease, osgood-schlatter's	coronary thrombosis	crohn's disease	disease, pelligrini-sieda	lyme disease	coronary insufficiency	disease, lyme	disease, parkinson's	parkinson's disease	collagenosis disease	inflammatory lung disease	parasitic disease, gastrointestinal	polycystic kidney disease	kidney: cystic diseases of	brain, disease due to trauma	renal disease: atherosclerotic	pulmonary: vascular disease	heart failure, congestive	peripheral vascular disease	reactive airway disease	bronchi and trachea, diseases of	vascular disease, pulmonary	lymphogranulomatosis (hodgkin's disease)	renal disease: amyloid	renal disease: vasculitis	motor neuron disease	caisson disease of bones	renal disease: glycosuria	auditory canal, disease of	bypass, coronary artery	cerebellar degenerative disease	renal disease: diabetic	vulva, disease or injury of	hypoadrenia (addison's disease)	disease, hansen's (leprosy)	obstructive pulmonary disease, chronic	cardiovascular disease, hypertensive	kidney: polycystic disease	airway disease, reactive	atherosclerotic renal disease	replacement: heart valve	hansen's disease (leprosy)	leprosy (hansen's disease)	vagina, disease or injury of	bones, caisson disease of	hypertensive cardiovascular disease	inflammatory duodenal disease	intervertebral disc disease	heart valve replacement	hypertensive vascular disease	pulmonary: disease, chronic obstructive	polycystic ovary disease	cervix, disease or injury of	chronic obstructive pulmonary disease (copd)	peripheral arterial occlusive disease	disease, marie-strumpell (ankylosing spondylitis)	chf (congestive heart failure)	central nervous system disease	uremic medullary cystic disease	gastroesophageal reflux disease (gerd)	buergers disease (thrombo-angiitis obliterans)	pelvic inflammatory disease (pid)	cad (coronary artery disease)	ovary: disease, injury, or adhesions of	ascites (a finding, not a disease)	alzheimer's type dementia (alzheimer's disease)	disease, paget's (osteitis deformans)	metatarsalgia, anterior (morton's disease)	renal disease: cortical necrosis	uterus: disease, injury, or adhesions of	congestive heart failure, unknown etiology	renal disease: chronic, requiring dialysis	dementia, alzheimer's type (alzheimer's disease)	disease, buerger's (thrombo-angiitis obliterans)	gerd (gastroesophageal reflux disease)	degenerative joint disease (djd)	morton's disease (morton's metatarsalgia)	parasitic diseases, not otherwise classified	renal disease: tubular disorders	disease, parasitic, otherwise not specified	degenerative disc disease (ddd)	paget's disease (osteitis deformans)	congestive heart failure (chf)	renal disease: tubular acidosis (aminoaciduria)	congestive heart failure, with arterial hypertension	fallopian tube, disease, injury or adhesions of	von recklinghausen's disease (neurofibromatosis type i)	copd (chronic obstructive pulmonary disease)	renal disease: sickle cell anemia	heart failure, congestive with arterial hypertension	coronary artery bypass graft (cabg)	hypofunction, adrenal cortex (addison's disease)	renal disease: systemic lupus erythematosus	adrenal cortical hypofunction (addison's disease)	chronic renal disease requiring regular dialysis	addison's disease (adrenal cortical hypofunction)	amyotrophic lateral sclerosis (lou gehrig's disease)	lou gehrig's disease (amyotrophic lateral sclerosis, als)	mental disorders: delirium, dementia, amnestic & cognitive disorders: dementia: due to other neurologic/general medical conditions (endocrine/metabolic disorders, picks disease, brain tumors, etc.) or substance-induced (drugs, alcohol, poisons)
