Primary fibromyalgia syndrome	fibromyalgia	reiter's syndrome	frolich's syndrome	bartter's syndrome	morgagni-adams-stokes syndrome	myelodysplastic syndromes	chronic brain syndrome	fatigue syndrome, chronic	cushing's syndrome	hypereosinophilic syndrome	ellison-zollinger syndrome	wernicke's syndrome	hypoventilation syndrome	extrapyramidal syndrome	wolf-parkinson-white syndrome	chronic fatigue syndrome	zollinger-ellison syndrome	pluriglandular syndrome	organic brain syndrome	sclerosis: primary lateral	brain syndrome, acute	post gastrectomy syndrome	irritable bowel syndrome	carpal tunnel syndrome	hyperpituitarism, with cushing's syndrome	korsakoff's psychosis or syndrome	primary lateral sclerosis	post concussion syndrome	brain syndrome, unknown etiology	colon syndrome, irritable	functional bowel syndrome	irritable colon syndrome	acute brain syndrome	glaucoma, noncongestive, (simple or primary)	marfan's syndrome with lens subluxation	rendu-osler-weber syndrome with gi bleeding	endolymphatic hydrops (meniere's syndrome)	osler-weber-rendu syndrome with gi bleeding	meniere's syndrome (endolymphatic hydrops)	post-phlebitic syndrome, any etiology	brain syndrome assoc. with alcoholism	brain syndrome, chronic (unknown etiology)	malabsorption syndrome secondary to sprue	essential thrombocythemia and primary myelofibrosis	brain syndrome assoc. with intracranial neoplasm	brain syndrome assoc. with metabolic disturbance	brain syndrome assoc. with convulsive disorder	fanconi's syndrome (renal tubular disorder)	brain syndrome assoc. with intracranial infection	brain syndrome assoc. with cns syphilis	brain syndrome assoc. with circulatory disturbance	brain syndrome assoc. with cerebral arteriosclerosis	sleep apnea syndromes (obstructive, central, mixed)	brain syndrome, assoc. with brain trauma	scalenus anticus syndrome (also known as anterior scalene muscle)
Injury of medial collateral ligament of knee	knee: residuals of injury	hypotonic, ligaments, knees	muscle injury, see injury, muscle.	injury: gallbladder	knee: meniscectomy	replacement: knee	injury: pharynx	injury: prostate	shoulder injury	injury: sacroiliac	mouth, injuries of	buttocks, injury	injury: lips	contusion, knee	injury: foot	pharynx, injuries to	injury: spleen	lips, injuries to	knee: ankylosis of	injury: liver	bladder, injury of	injury: mouth	injury: larynx	injury: bladder	cold injuries, residuals of	knee: other impairment with instability	vulva, disease or injury of	injury: muscle: facial	breast injury (male)	knee: replacement (prosthesis)	eye, injury of, unhealed	injury: pleural cavity	varus deformity, knee	knee: internal derangement	vagina, disease or injury of	facial muscles, injury	gall bladder, injury of	injury: stomach, residuals	fracture, residuals of: knee	sacroiliac injury or weakness	impairment: knee (other)	injury: eye, unhealed.	cervix, disease or injury of	uterus: disease, injury, or adhesions of	ovary: disease, injury, or adhesions of	meniscectomy, knee, po residuals	injury: tongue, whole or part	prostate gland: injuries, infections, hypertrophy	shrapnel injury (depending on depth)	fallopian tube, disease, injury or adhesions of	injury: muscle: groups i to xxiii
Fracture of the vertebral column with spinal cord injury	new growths, malignant*: spinal cord	malignant new growth of: spinal cord	growths, new, benign: spinal cord	new growths, benign: spinal cord	benign new growths of the spinal cord	growths, new, malignant: spinal cord	muscle injury, see injury, muscle.	toes, fracture of	injury: pharynx	injury: lips	jaw, fracture of	lips, injuries to	injury: larynx	injury: prostate	injury: sacroiliac	pharynx, injuries to	vertebral spurring	vertebra fracture	injury: bladder	injury: gallbladder	mouth, injuries of	injury: foot	injury: spleen	injury: liver	bladder, injury of	shoulder injury	buttocks, injury	nasal fracture	injury: mouth	fracture, residuals of: skull	fracture, residuals of: spine	injury: muscle: facial	knee: residuals of injury	fracture, residuals of: hip	fracture, residuals of: finger	fracture, residuals of: ankle	fracture, residuals of: vertebra	fracture, residuals of: humerus	fracture, residuals of: elbow	fracture, residuals of: pelvis	cervix, disease or injury of	breast injury (male)	fracture, residuals of: femur	fracture, residuals of: sternum	fracture, vertebra, residuals of	injury: pleural cavity	fracture, residuals of: tibia	fracture, residuals of: clavicle	fracture, residuals of: calcaneus	fracture, residuals of: rib	injury: eye, unhealed.	fracture, residuals of: nose	fracture, residuals of: fibula	eye, injury of, unhealed	fracture, residuals of: radius	injury: stomach, residuals	sacroiliac injury or weakness	cold injuries, residuals of	fracture, residuals of: toes	vulva, disease or injury of	fracture, residuals of: ulna	wrist fracture, healed	polyp: vocal cord	facial muscles, injury	gall bladder, injury of	fracture, residuals of: wrist	fracture, residuals of: knee	vagina, disease or injury of	injury: tongue, whole or part	fracture, residuals of: cervical spine	uterus: disease, injury, or adhesions of	ovary: disease, injury, or adhesions of	fracture, residuals of: os calcis or astragalus	injury: muscle: groups i to xxiii	fallopian tube, disease, injury or adhesions of	prostate gland: injuries, infections, hypertrophy	fracture, residuals of: carpal navicular bone	fracture, vertebra, compression, with hypertrophic arthritis	shrapnel injury (depending on depth)	fracture, residuals of: compression type, lumbar vertebra	fracture, residuals of: skull with neuro residuals	paralysis, nerve: cranial: spinal accessory, external branch (eleventh)	neuritis: cranial nerves: spinal accessory, external branch (eleventh)	neuralgia: cranial nerves: spinal accessory, external branch (eleventh)
Injury of tendon of the rotator cuff of shoulder	shoulder injury	rotator cuff tear	muscle injury, see injury, muscle.	injury: gallbladder	injury: pharynx	injury: prostate	injury: sacroiliac	shoulder replacement	mouth, injuries of	buttocks, injury	injury: lips	injury: foot	pharynx, injuries to	injury: spleen	lips, injuries to	injury: liver	bladder, injury of	calcified tendonitis	replacement: shoulder	injury: mouth	injury: larynx	injury: bladder	facial muscles, injury	gall bladder, injury of	injury: stomach, residuals	dislocation, shoulder, recurrent	sacroiliac injury or weakness	injury: eye, unhealed.	cervix, disease or injury of	tendonitis (or, tendinitis)	cold injuries, residuals of	vagina, disease or injury of	vulva, disease or injury of	injury: muscle: facial	knee: residuals of injury	breast injury (male)	eye, injury of, unhealed	injury: pleural cavity	injury: tongue, whole or part	uterus: disease, injury, or adhesions of	ovary: disease, injury, or adhesions of	shrapnel injury (depending on depth)	injury: muscle: groups i to xxiii	fallopian tube, disease, injury or adhesions of	clear cell sarcoma of tendons and aponeuroses	prostate gland: injuries, infections, hypertrophy
Recurrent urinary tract infection	carcinoma: urinary tract	pharynx, infected	fungus infection	dementia due infection	treponemal infections	incontinence, urinary	mental disorders: delirium, dementia, amnestic & cognitive disorders: dementia: due to infection (hiv infection, syphilis, or other systemic or intracranial infections)	diverticula of urinary bladder	urinary frequency with pyuria	dementia due to other intracranial infection	dementia due to other systemic infection	feet, infection and ulcers of	carcinoma: bladder, urinary	bladder cancer, urinary	hepatitis c infection	carcinoma: urinary bladder	hepatitis b infection	dementia due to hiv infection	mycobacterial intracellular infection	dislocation, shoulder, recurrent	intestinal parasitic infection	brain syndrome assoc. with intracranial infection	prostate gland: injuries, infections, hypertrophy
Pyelonephritis	pyelonephritis, chronic
Tear of meniscus of knee	knee: meniscectomy	knee: ankylosis of	replacement: knee	contusion, knee	hypotonic, ligaments, knees	knee: other impairment with instability	rotator cuff tear	knee: residuals of injury	fracture, residuals of: knee	knee: internal derangement	varus deformity, knee	impairment: knee (other)	knee: replacement (prosthesis)	meniscectomy, knee, po residuals
Acute Cholecystitis	cholecystitis, chronic	osteomyelitis: acute, subacute or chronic	leukemia, acute nonlymphocytic	nonlymphocytic leukemia, acute	brain syndrome, acute	acute nonlymphocytic leukemia	acute brain syndrome	acute and subacute peripheral neuropathy
Cholelithiasis	cholelithiasis, chronic
Chronic kidney disease stage 2 (disorder)	kidney: cystic diseases of	polycystic kidney disease	kidney: polycystic disease	kidney: medullary sponge kidney	renal disease: involvment in other diseases	cardiovascular-renal disease	kidney: calculus	kidney: abcess	hodgkin's disease	tuberculosis: kidney	kidney: stones	disease, grave's	kidney: horseshoe	acneform disease	horseshoe kidney	meniere's disease	raynaud's disease	disease, morton's	disease, addison's	osgood-schlatter's disease	kidney: tuberculosis of	kidney: transplant	scheuermann's disease	disease, jakob-creutzfeldt	kidney: enlarged	skin disease	disease, meniere's	demyelinating disease	disease, scheuermann's	disease, caisson	transplant, kidney	jakob-creutzfeldt disease	carcinoma: kidney	calculus, kidney	kidney: cancer	disease, raynaud's	pellegrini-stieda disease	abscess, kidney	grave's disease	disease, osgood-schlatter's	polyp: kidney	crohn's disease	lyme disease	disease, pelligrini-sieda	disease, lyme	disease, parkinson's	parkinson's disease	collagenosis disease	medullary sponge kidney	motor neuron disease	heart disease: arterioscerotic	polycystic ovary disease	cerebellar degenerative disease	renal disease: diabetic	disease, hansen's (leprosy)	hypertensive cardiovascular disease	vascular disease, pulmonary	heart disease: hypertensive	cardiovascular disease, hypertensive	intervertebral disc disease	renal disease: amyloid	airway disease, reactive	atherosclerotic renal disease	renal disease: atherosclerotic	heart disease: hyperthyroid	hyperthyroid heart disease	rheumatic heart disease	vulva, disease or injury of	heart disease: rheumatic	heart disease: valvular	parasitic disease, gastrointestinal	kidney: removal of one	caisson disease of bones	hypertensive vascular disease	pulmonary: disease, chronic obstructive	pulmonary: vascular disease	auditory canal, disease of	leprosy (hansen's disease)	vagina, disease or injury of	cervix, disease or injury of	hypoadrenia (addison's disease)	bronchi and trachea, diseases of	inflammatory lung disease	lymphogranulomatosis (hodgkin's disease)	renal disease: vasculitis	hypertensive heart disease	beriberi heart disease	heart disease: beriberi	renal disease: glycosuria	hansen's disease (leprosy)	peripheral vascular disease	coronary heart disease	bones, caisson disease of	reactive airway disease	obstructive pulmonary disease, chronic	inflammatory duodenal disease	valvular heart disease	brain, disease due to trauma	disease, marie-strumpell (ankylosing spondylitis)	coronary artery disease (cad)	gastroesophageal reflux disease (gerd)	pelvic inflammatory disease (pid)	arteriosclerotic heart disease (ashd)	ascites (a finding, not a disease)	alzheimer's type dementia (alzheimer's disease)	central nervous system disease	uremic medullary cystic disease	uterus: disease, injury, or adhesions of	cad (coronary artery disease)	renal disease: chronic, requiring dialysis	ovary: disease, injury, or adhesions of	disease, paget's (osteitis deformans)	metatarsalgia, anterior (morton's disease)	parasitic diseases, not otherwise classified	renal disease: tubular disorders	renal disease: cortical necrosis	disease, parasitic, otherwise not specified	degenerative disc disease (ddd)	paget's disease (osteitis deformans)	dementia, alzheimer's type (alzheimer's disease)	disease, buerger's (thrombo-angiitis obliterans)	gerd (gastroesophageal reflux disease)	degenerative joint disease (djd)	buergers disease (thrombo-angiitis obliterans)	morton's disease (morton's metatarsalgia)	chronic obstructive pulmonary disease (copd)	peripheral arterial occlusive disease	ashd (arterioscerotic heart disease)	copd (chronic obstructive pulmonary disease)	renal disease: sickle cell anemia	hypofunction, adrenal cortex (addison's disease)	renal disease: systemic lupus erythematosus	adrenal cortical hypofunction (addison's disease)	cor pulmonale (secondary heart disease)	chronic renal disease requiring regular dialysis	addison's disease (adrenal cortical hypofunction)	removal (see also surgery): kidney	renal disease: tubular acidosis (aminoaciduria)	fallopian tube, disease, injury or adhesions of	von recklinghausen's disease (neurofibromatosis type i)	amyotrophic lateral sclerosis (lou gehrig's disease)	lou gehrig's disease (amyotrophic lateral sclerosis, als)	mental disorders: delirium, dementia, amnestic & cognitive disorders: dementia: due to other neurologic/general medical conditions (endocrine/metabolic disorders, picks disease, brain tumors, etc.) or substance-induced (drugs, alcohol, poisons)
Microalbuminuria due to type 2 diabetes mellitus (disorder)	diabetes mellitus	diabetes insipidus	retinopathy, diabetic	renal disease: diabetic
Metastasis from malignant tumor of prostate (disorder)	brain tumor, malignant	prostatitis	pineloma, malignant	calculus, prostate	teratoma, malignant	carcinoma: prostate	adenocarcinoma, prostate	injury: prostate	hypertophy, prostatic	resection: prostate	pheochromocytoma (benign or malignant)	brain tumor, metastatic	brain tumor, benign	malignant neoplasms of the breast	prostate gland: cancer	metastatic brain tumor	prostate gland: calculus	prostate gland: enlarged	muscle growths, malignant	hemangioma, malignant, of esophagus	breast, malignant neoplasm of the	prostate gland: adenocarcinoma	growths, new, malignant: skin	gynecological system neoplasms, malignant	malignant new growth of: eyeball	benign prostatic hypertrophy (bph)	genitourinary system neoplasms, malignant	growths, new, malignant: breast	growths, new, malignant: ear	bones, malignant new growths of	growths, new, malignant: respiratory	growths, new, malignant: muscle	turp (transurethral resection of the prostate)	bones, new growths of, malignant	growths, new, malignant: bones	malignant new growth of: skin	growths, new, malignant: brain	brain, new growths of, malignant	bph (benign prostatic hypertrophy)	malignant new growth of: ear	malignant new growth of: brain	brain, malignant new growths of	growths, new, malignant: genitourinary system	brain & central nervous system, tumors of the	prostate gland: injuries, infections, hypertrophy	growths, new, malignant: spinal cord	growths, new, malignant: digestive system	growths, new, malignant: endocrine system	growths, new, malignant: eyeball only	malignant new growth of: spinal cord	malignant neoplasm, gynecological system or breast	malignant new growth of: digestive system	growths, new, malignant: gynecological system	malignant neoplasms of the hard and soft tissue	removal (see also surgery): prostate	malignant new growth of: gynecological system or breast	mental disorders: delirium, dementia, amnestic & cognitive disorders: dementia: due to other neurologic/general medical conditions (endocrine/metabolic disorders, picks disease, brain tumors, etc.) or substance-induced (drugs, alcohol, poisons)
Concussion injury of brain	concussion	muscle injury, see injury, muscle.	brain syndrome, assoc. with brain trauma	injury: mouth	chronic brain syndrome	injury: larynx	brain embolism	injury: sacroiliac	abscess, brain	pharynx, injuries to	lips, injuries to	thrombosis, brain	brain cancer	carcinoma: brain	injury: prostate	mouth, injuries of	injury: foot	injury: liver	bladder, injury of	brain, abscess of	injury: bladder	injury: gallbladder	shoulder injury	trauma, brain	buttocks, injury	injury: spleen	brain hemorrhage	brain, thrombosis of	injury: pharynx	injury: lips	organic brain syndrome	eye, injury of, unhealed	embolism, brain vessels	brain, vessels, thrombosis of	brain tumor, benign	injury: stomach, residuals	metastatic brain tumor	hemorrhage, brain vessels	sacroiliac injury or weakness	cold injuries, residuals of	vulva, disease or injury of	brain syndrome, acute	benign neoplasms of the brain	brain tumor, malignant	facial muscles, injury	brain tumor, metastatic	gall bladder, injury of	cerebral concussion, residuals	brain syndrome, unknown etiology	vagina, disease or injury of	acute brain syndrome	injury: muscle: facial	knee: residuals of injury	brain, vessels, hemorrhage from	post concussion syndrome	cervix, disease or injury of	breast injury (male)	brain trauma, residuals of	injury: pleural cavity	brain, disease due to trauma	brain, vessels, embolism of	injury: eye, unhealed.	injury: tongue, whole or part	benign new growths of the brain	growths, new, malignant: brain	new growths, malignant*: brain	new growths, benign: brain	brain syndrome assoc. with alcoholism	brain syndrome, chronic (unknown etiology)	brain, new growths of, malignant	ovary: disease, injury, or adhesions of	brain, malignant new growths of	brain, new growths of, benign	growths, new, benign: brain	uterus: disease, injury, or adhesions of	brain, benign new growths of	malignant new growth of: brain	thrombosis, brain, internal carotid artery	brain syndrome assoc. with cns syphilis	brain syndrome assoc. with convulsive disorder	brain & central nervous system, tumors of the	brain syndrome assoc. with cerebral arteriosclerosis	brain syndrome assoc. with metabolic disturbance	injury: muscle: groups i to xxiii	fallopian tube, disease, injury or adhesions of	brain syndrome assoc. with intracranial infection	prostate gland: injuries, infections, hypertrophy	brain syndrome assoc. with circulatory disturbance	brain trauma, residuals with headaches only	shrapnel injury (depending on depth)	brain syndrome assoc. with intracranial neoplasm	mental disorders: delirium, dementia, amnestic & cognitive disorders: dementia: due to other neurologic/general medical conditions (endocrine/metabolic disorders, picks disease, brain tumors, etc.) or substance-induced (drugs, alcohol, poisons)
Primary malignant neoplasm of colon	breast, malignant neoplasm of the	malignant neoplasms of the breast	gynecological system neoplasms, malignant	genitourinary system neoplasms, malignant	malignant neoplasm, gynecological system or breast	malignant neoplasms of the hard and soft tissue	colon, hypertonic	colon cancer	pineloma, malignant	teratoma, malignant	carcinoma: colon	benign neoplasms of the breast	hemangioma, malignant, of esophagus	sclerosis: primary lateral	benign neoplasms of the brain	brain tumor, malignant	primary lateral sclerosis	pheochromocytoma (benign or malignant)	colon syndrome, irritable	muscle growths, malignant	irritable colon syndrome	growths, new, malignant: respiratory	growths, new, malignant: muscle	benign neoplasms, genitourinary system	bones, new growths of, malignant	growths, new, malignant: bones	malignant new growth of: skin	growths, new, malignant: brain	neoplasms, malignant*: genitourinary system	brain, new growths of, malignant	malignant new growth of: ear	benign neoplasms of the respiratory system	neoplasms, benign: endocrine system	growths, new, malignant: ear	genitourinary system neoplasms, benign	malignant new growth of: brain	essential thrombocythemia and primary myelofibrosis	brain, malignant new growths of	growths, new, malignant: skin	glaucoma, noncongestive, (simple or primary)	neoplasms, benign: genitourinary system	malignant new growth of: eyeball	neoplasms, malignant*: endocrine system	growths, new, malignant: breast	bones, malignant new growths of	growths, new, malignant: eyeball only	neoplasms, benign: gynecological system 	brain syndrome assoc. with intracranial neoplasm	malignant new growth of: spinal cord	growths, new, malignant: gynecological system	malignant new growth of: digestive system	growths, new, malignant: genitourinary system	neoplasms, malignant*: gynecological system or breast	benign neoplasms of the hard and soft tissue	benign neoplasms, gynecological system 	growths, new, malignant: spinal cord	growths, new, malignant: digestive system	growths, new, malignant: endocrine system	malignant new growth of: gynecological system or breast	neoplasms, malignant*: respiratory system, exclusive of skin growths
Bullet wound	shell fragment wound (depending on depth)
Chronic paralysis due to lesion of spinal cord	benign new growths of the spinal cord	malignant new growth of: spinal cord	new growths, malignant*: spinal cord	growths, new, benign: spinal cord	new growths, benign: spinal cord	growths, new, malignant: spinal cord	paralysis: agitans	paralysis: accommodation	paralysis, nerve: cranial: spinal accessory, external branch (eleventh)	eye, accommodation, paralysis of	polyp: vocal cord	eye, paralysis of accomodation	accomodation, paralysis of (eye)	diaphragm, paralysis or paresis	paralysis, nerve: peripheral: circumflex	paralysis, nerve: peripheral: ulnar	paralysis, nerve: peripheral: obturator	paralysis, nerve: peripheral: sciatic	paralysis, nerve: peripheral: musculospiral	paralysis, nerve: peripheral: ilio-inguinal	paralysis, nerve: peripheral: median	paralysis, nerve: peripheral: musculocutaneous	paralysis, nerve: cranial: facial (seventh)	paralysis, nerve: cranial: trigeminal (fifth)	paralysis, nerve: cranial: glossopharyngeal (ninth)	paralysis, nerve: cranial: seventh (facial)	paralysis, nerve: peripheral: long thoracic	paralysis, nerve: cranial: hypoglossal (twelfth)	paralysis, nerve: peripheral: external popliteal	paralysis, nerve: cranial: fifth (trigeminal)	paralysis, nerve: cranial: ninth (glossopharyngeal)	paralysis, nerve: cranial: twelfth (hypoglossal)	paralysis, nerve: peripheral: anterior crural	paralysis, nerve: peripheral: internal saphenous	paralysis, nerve: peripheral: anterior tibial	paralysis, nerve: peripheral: posterior tibial	paralysis, nerve: peripheral: internal popliteal	paralysis, nerve: peripheral: external cutaneous, thigh	paralysis, nerve: peripheral: lower radicular group	paralysis, nerve: peripheral: all radicular groups	paralysis, nerve: peripheral: musculocutaneous (superficial peroneal)	paralysis, nerve: peripheral: middle radicular group	paralysis, nerve: peripheral: upper radicular group	paralysis, nerve: cranial: tenth (pneumogastric, vagus)	paralysis, nerve: cranial: pneumogastric, vagus (tenth )	neuritis: cranial nerves: spinal accessory, external branch (eleventh)	neuralgia: cranial nerves: spinal accessory, external branch (eleventh)	paralysis, nerve: cranial: eleventh (spiral accessory, external branch)
Proliferative diabetic retinopathy due to type II diabetes mellitus (disorder)	diabetes mellitus	retinopathy, diabetic	diabetes insipidus	renal disease: diabetic	retinopathy, central
History of amputation of foot (situation)	foot ulcer	injury: foot	calluses, foot	foot fungus	trench foot	club foot	foot drop	weak foot	immersion foot	athlete's foot	ulcer: foot	drop foot	upper extremity amputations	amputations, upper extremity	amputations, lower extremity	lower extremity amputations	limitation of extension: leg and foot	loss of use of: foot, one	neuropathy, interior tibial with foot drop	jungle rot of feet (trench foot)	claw foot (pes cavus), acquired
